,Unnamed: 0,uid,domainID,siteID,namedLocation,locationID,startDate,endDate,ongoingEvent,estimatedOrActualDate,dateRemarks,eventID,samplingProtocolVersion,eventType,methodTypeChoice,name,scientificName,otherScientificName,fireSeverity,biomassRemoval,minQuantity,maxQuantity,quantityUnit,reporterType,remarks,recordedBy,dataQF,publicationDate,release
1284,1284,41350022-9cdb-46f9-a16a-7c5b4db6e2ff,D03,JERC,JERC,"JERC_006.basePlot.all, JERC_006.mammalGrid.mam, JERC_006.birdGrid.brd",3/30/22,4/8/22,N,estimated,Sometime before April 11,JERC.20220330.fire,NEON.DOC.003282vD,fire,fire-controlledBurn,,,,low,,,,,primary,Some areas more intense fire. Only a portion of bird grid burned.,0000-0002-9814-2044,,20241118T115644Z,RELEASE-2025
1291,1291,49bd8cfe-74bb-4ab1-b245-a9fe4291bd6d,D03,JERC,JERC,"JERC_047.basePlot.all, JERC_050.basePlot.all, JERC_054.basePlot.all, JERC_062.basePlot.all, JERC_080.phenology.phe, SOILPL100426, SOILPL100427, SOILPL100428, SOILPL103191, SOILPL103245, TOWER100381, HUT106240, AIRSHED",4/21/22,4/21/22,N,actual,,JERC.20220421.fire,NEON.DOC.003282vD,fire,fire-controlledBurn,,,,low,,,,,primary,Area around soil plots burned but soil plots themselves untouched. Burn was patchy leaving about 5% of the area unburned. JERC_052 was only burned on the southern 3-4m of the 40m square i.e. the road running through the plot was the fire break thus the portion used for DHP was unaffected.,0000-0001-5871-8742,,20241118T115644Z,RELEASE-2025
1292,1292,5c3d16dd-5fb7-4961-b542-c413f59adfcd,D03,JERC,JERC,JERC_024.basePlot.all,4/18/22,4/25/22,N,estimated,Sometime in the last week,JERC.20220418.fire,NEON.DOC.003282vD,fire,fire-controlledBurn,,,,medium,,,,,primary,Controlled burn on planted pine hedgerow that is the southern quarter of the plot.,0000-0002-9814-2044,,20241118T115644Z,RELEASE-2025
1295,1295,79ced8bf-3d46-4eae-8440-1358f8d3f36e,D03,JERC,JERC,"JERC_007.basePlot.all, JERC_081.tickPlot.tck, JERC_070.mosquitoPoint.mos",4/26/22,4/26/22,N,actual,,JERC.20220426.fire,NEON.DOC.003282vD,fire,fire-controlledBurn,,,,low,,,,,primary,Patchy burn through out plot. About 70 percent of tick JERC_081 burned.,0000-0002-9814-2044,,20241118T115644Z,RELEASE-2025
1296,1296,4cd84a87-7369-4c24-957e-d887aca761e2,D03,JERC,JERC,JERC_074.mosquitoPoint.mos,4/18/22,4/29/22,N,estimated,Sometime in the last week.,JERC.20220418.fire,NEON.DOC.003282vD,fire,fire-controlledBurn,,,,low,,,,,primary,Patchy burn,0000-0002-9814-2044,,20241118T115644Z,RELEASE-2025
1301,1301,2b64d9ee-1db7-4a22-98ab-312cc5bb4dd5,D03,JERC,JERC,"SOILPL100426, SOILPL100427, SOILPL100428, SOILPL103191, SOILPL103245, TOWER100381, HUT106240, AIRSHED",5/11/22,5/11/22,N,actual,,JERC.20220511.fire,NEON.DOC.003282vD,fire,fire-controlledBurn,,,,low,,,,,primary,Burn conducted so soil plots reflect surrounding habitat management,0000-0001-5871-8742,,20241118T074341Z,RELEASE-2025
1340,1340,1265a6fb-641b-4a33-8559-1fcf1757d318,D03,JERC,JERC,"JERC_048.basePlot.all, JERC_053.basePlot.all, JERC_056.basePlot.all, JERC_049.basePlot.all, JERC_067.phenology.phe, JERC_055.basePlot.all, JERC_052.basePlot.all",3/21/23,3/21/23,N,actual,Some logs continued to smolder several days after the burn.,JERC.20230321.fire,NEON.DOC.003282vD,fire,fire-controlledBurn,,,,medium,,,,,primary,Only one half of JERC_048 burned since fire break cut through the plot.,0000-0002-9814-2044,,20241118T155325Z,RELEASE-2025
1341,1341,23ecc927-c81c-4a01-9512-98a08615b752,D03,JERC,JERC,"JERC_055.basePlot.all, JERC_061.basePlot.all, JERC_066.basePlot.all, JERC_008.basePlot.all, JERC_005.basePlot.all, JERC_009.mammalGrid.mam, no plots listed for this site, JERC_017.basePlot.all, JERC_002.tickPlot.tck, JERC_011.basePlot.all, JERC_011.tickPlot.tck, JERC_004.tickPlot.tck",3/21/23,3/21/23,N,actual,Some logs continued to smolder for several days after burn.,JERC.20230321.fire,NEON.DOC.003282vD,fire,fire-controlledBurn,,,,low,,,,,primary,JERC_055 burned at lower intensity than surrounding plots. Only part of JERC_066,0000-0002-9814-2044,,20241118T155325Z,RELEASE-2025
1346,1346,bece9c4f-c880-466e-b62e-63820cf0f4f7,D03,JERC,JERC,JERC_033.basePlot.all,4/3/23,4/30/23,N,estimated,Sometime this spring possibly April or May.,JERC.20230403.fire,NEON.DOC.003282vD,fire,fire-controlledBurn,,,,low,,,,,primary,Plot burned at unknown spring date. Based on vegetation regrowth it appears to have been a low intensity burn.,0000-0002-9814-2044,,20241118T082621Z,RELEASE-2025
1347,1347,a8187d4d-4d04-4ddd-b64f-77f1f0c013b7,D03,JERC,JERC,"JERC_077.mosquitoPoint.mos, JERC_010.basePlot.all, JERC_022.basePlot.all, JERC_064.basePlot.all, JERC_010.tickPlot.tck, JERC_042.birdGrid.brd",4/1/23,5/1/23,N,estimated,Regrowth not very far along; fire likely occurred after large March 21 2023 fire.,JERC.20230401.fire,NEON.DOC.003282vD,fire,fire-controlledBurn,,,,low,,,,,primary,JERC_010R was only half burned. There is a large oak on one side of plot with a lot of leaf litter that did not burn.,0000-0001-5833-8133,,20241118T195135Z,RELEASE-2025
1348,1348,c9b79a88-fde5-49ea-a73c-f0cfa37a247c,D03,JERC,JERC,"JERC_072.mosquitoPoint.mos, JERC_079.mosquitoPoint.mos, JERC_076.mosquitoPoint.mos, JERC_001.basePlot.all, JERC_081.tickPlot.tck, JERC_030.basePlot.all",5/2/23,5/2/23,N,actual,,JERC.20230502.fire,NEON.DOC.003282vD,fire,fire-controlledBurn,,,,low,,,,,primary,,0000-0001-5833-8133,,20241118T195135Z,RELEASE-2025
1508,1508,0c7f8ad3-7b35-46e9-88fe-39dab3ee9f3e,D06,KONZ,KONZ,"KONZ_017.basePlot.all, KONZ_019.basePlot.all, KONZ_009.tickPlot.tck",3/14/13,3/14/13,N,actual,,KONZ.20130314.fire,NEON.DOC.003282vA,fire,fire-controlledBurn,,,,low,,,,,secondary,,eminnick@battelleecology.org,,20241118T204032Z,RELEASE-2025
1509,1509,56e05442-b9fb-456e-921c-9ed5d11a575e,D06,KONZ,KONZ,"KONZ_028.basePlot.all, KONZ_030.basePlot.all, KONZ_046.basePlot.all, KONZ_049.basePlot.all, KONZ_059.basePlot.all, KONZ_063.basePlot.all, KONZ_067.basePlot.all",3/15/13,3/15/13,N,actual,,KONZ.20130315.fire,NEON.DOC.003282vA,fire,fire-controlledBurn,,,,low,,,,,secondary,,eminnick@battelleecology.org,,20241118T204032Z,RELEASE-2025
1510,1510,71650f91-1a7d-46e4-b3fd-e0b0f9a79e87,D06,KONZ,KONZ,"KONZ_022.basePlot.all, KONZ_023.basePlot.all, KONZ_024.basePlot.all, KONZ_004.tickPlot.tck",3/28/13,3/28/13,N,actual,,KONZ.20130328.fire,NEON.DOC.003282vA,fire,fire-controlledBurn,,,,low,,,,,secondary,,eminnick@battelleecology.org,,20241118T204032Z,RELEASE-2025
1513,1513,fa3e1d7f-b18a-40b2-be2b-c2db350fbeac,D06,KONZ,KONZ,"KONZ_005.basePlot.all, KONZ_012.basePlot.all, KONZ_005.mammalGrid.mam, KONZ_033.mosquitoPoint.mos, KONZ_038.mosquitoPoint.mos",4/3/13,4/3/13,N,actual,,KONZ.20130403.fire,NEON.DOC.003282vA,fire,fire-controlledBurn,,,,low,,,,,secondary,,eminnick@battelleecology.org,,20241118T071140Z,RELEASE-2025
1514,1514,a3ab1e83-a0e2-4262-a073-bba7b97f60b5,D06,KONZ,KONZ,"KONZ_001.basePlot.all, KONZ_018.basePlot.all, KONZ_001.tickPlot.tck, KONZ_001.mammalGrid.mam",4/8/13,4/8/13,N,actual,,KONZ.20130408.fire,NEON.DOC.003282vA,fire,fire-controlledBurn,,,,low,,,,,secondary,,eminnick@battelleecology.org,,20241118T071140Z,RELEASE-2025
1515,1515,29da51a2-135c-44a4-9895-8cc282ef5e22,D06,KONZ,KONZ,"KONZ_006.basePlot.all, KONZ_006.mammalGrid.mam",4/13/13,4/13/13,N,actual,,KONZ.20130413.fire,NEON.DOC.003282vA,fire,fire-controlledBurn,,,,low,,,,,secondary,,eminnick@battelleecology.org,,20241118T071140Z,RELEASE-2025
1516,1516,10f84789-eeac-4ab4-8c0f-b5e6d0c1480c,D06,KONZ,KONZ,"KONZ_013.basePlot.all, KONZ_020.basePlot.all",4/29/13,4/29/13,N,actual,,KONZ.20130429.fire,NEON.DOC.003282vA,fire,fire-controlledBurn,,,,low,,,,,secondary,,eminnick@battelleecology.org,,20241118T071140Z,RELEASE-2025
1570,1570,b0e3cf61-5849-4341-8284-fed914dd1d7f,D06,KONZ,KONZ,"KONZ_034.mosquitoPoint.mos, KONZ_037.mosquitoPoint.mos, KONZ_038.mosquitoPoint.mos",3/10/14,3/10/14,N,actual,,KONZ.20140310.fire,NEON.DOC.003282vA,fire,fire-controlledBurn,,,,low,,,,,secondary,,eminnick@battelleecology.org,,20241118T023908Z,RELEASE-2025
1571,1571,8e05163a-163a-451b-8ee8-5cb24c147026,D06,KONZ,KONZ,KONZ_023.basePlot.all,3/23/14,3/23/14,N,actual,,KONZ.20140323.fire,NEON.DOC.003282vA,fire,fire-controlledBurn,,,,low,,,,,secondary,,eminnick@battelleecology.org,,20241118T023908Z,RELEASE-2025
1573,1573,f75d216d-8eeb-41a5-9203-d77b935ebd40,D06,KONZ,KONZ,"KONZ_015.basePlot.all, KONZ_036.mosquitoPoint.mos",3/27/14,3/27/14,N,actual,,KONZ.20140327.fire,NEON.DOC.003282vA,fire,fire-controlledBurn,,,,low,,,,,secondary,,eminnick@battelleecology.org,,20241118T023908Z,RELEASE-2025
1574,1574,774f2044-8a2f-4d48-abc3-fa5547924632,D06,KONZ,KONZ,"KONZ_017.basePlot.all, KONZ_019.basePlot.all, KONZ_028.basePlot.all, KONZ_030.basePlot.all, KONZ_046.basePlot.all, KONZ_049.basePlot.all, KONZ_059.basePlot.all, KONZ_063.basePlot.all, KONZ_067.basePlot.all, KONZ_009.tickPlot.tck",3/28/14,3/28/14,N,actual,,KONZ.20140328.fire,NEON.DOC.003282vA,fire,fire-controlledBurn,,,,low,,,,,secondary,,eminnick@battelleecology.org,,20241118T023908Z,RELEASE-2025
1575,1575,d0cb817b-7db0-42a3-bac9-dc30230417f4,D06,KONZ,KONZ,"KONZ_013.basePlot.all, KONZ_020.basePlot.all, KONZ_042.basePlot.all, KONZ_044.basePlot.all, KONZ_050.basePlot.all, KONZ_051.basePlot.all, KONZ_053.basePlot.all, KONZ_054.basePlot.all, KONZ_055.basePlot.all, KONZ_056.basePlot.all, KONZ_064.basePlot.all, KONZ_065.basePlot.all, KONZ_068.basePlot.all, KONZ_070.basePlot.all, KONZ_072.phenology.phe",3/29/14,3/29/14,N,actual,,KONZ.20140329.fire,NEON.DOC.003282vA,fire,fire-controlledBurn,,,,low,,,,,secondary,,eminnick@battelleecology.org,,20241118T023908Z,RELEASE-2025
1577,1577,a5a20205-5984-449f-b55f-4708473898f7,D06,KONZ,KONZ,"KONZ_011.basePlot.all, KONZ_014.basePlot.all, KONZ_019.basePlot.all, KONZ_043.basePlot.all, KONZ_045.basePlot.all, KONZ_047.basePlot.all, KONZ_048.basePlot.all, KONZ_052.basePlot.all, KONZ_057.basePlot.all, KONZ_058.basePlot.all, KONZ_060.basePlot.all, KONZ_061.basePlot.all, KONZ_062.basePlot.all, KONZ_066.basePlot.all, KONZ_069.basePlot.all, KONZ_071.basePlot.all, KONZ_039.mosquitoPoint.mos",4/1/14,4/1/14,N,actual,,KONZ.20140401.fire,NEON.DOC.003282vA,fire,fire-controlledBurn,,,,low,,,,,secondary,,eminnick@battelleecology.org,,20241118T113029Z,RELEASE-2025
1578,1578,4252cfa7-7b7c-4a31-8dc1-40f2776aaa57,D06,KONZ,KONZ,"KONZ_001.basePlot.all, KONZ_005.basePlot.all, KONZ_006.basePlot.all, KONZ_001.tickPlot.tck, KONZ_001.mammalGrid.mam, KONZ_005.mammalGrid.mam, KONZ_006.mammalGrid.mam",4/11/14,4/11/14,N,actual,,KONZ.20140411.fire,NEON.DOC.003282vA,fire,fire-controlledBurn,,,,low,,,,,secondary,,eminnick@battelleecology.org,,20241118T113029Z,RELEASE-2025
1579,1579,99dfd882-bf2a-4bdc-91ab-70bf657ec48f,D06,KONZ,KONZ,KONZ_035.mosquitoPoint.mos,4/15/14,4/15/14,N,actual,,KONZ.20140415.fire,NEON.DOC.003282vA,fire,fire-controlledBurn,,,,low,,,,,secondary,,eminnick@battelleecology.org,,20241118T113029Z,RELEASE-2025
1594,1594,a7d5d3a9-a6bd-4ea8-bd2f-067aac231115,D06,KONZ,KONZ,KONZ_041.mosquitoPoint.mos,7/24/14,7/24/14,N,actual,,KONZ.20140724.fire,NEON.DOC.003282vA,fire,fire-controlledBurn,,,,low,,,,,secondary,,eminnick@battelleecology.org,,20241118T171718Z,RELEASE-2025
1629,1629,d0b12f5f-88bc-4721-8095-c55fbc77ef38,D06,KONZ,KONZ,"KONZ_004.basePlot.all, KONZ_007.basePlot.all, KONZ_008.basePlot.all, KONZ_023.basePlot.all, KONZ_007.tickPlot.tck",3/9/15,3/9/15,N,actual,,KONZ.20150309.fire,NEON.DOC.003282vA,fire,fire-controlledBurn,,,,low,,,,,secondary,,eminnick@battelleecology.org,,20241118T165724Z,RELEASE-2025
1630,1630,7efbe3df-57c2-4e1f-b85e-8c99a838fadf,D06,KONZ,KONZ,"KONZ_005.basePlot.all, KONZ_013.basePlot.all, KONZ_017.basePlot.all, KONZ_019.basePlot.all, KONZ_020.basePlot.all, KONZ_028.basePlot.all, KONZ_030.basePlot.all, KONZ_046.basePlot.all, KONZ_049.basePlot.all, KONZ_059.basePlot.all, KONZ_063.basePlot.all, KONZ_067.basePlot.all, KONZ_009.tickPlot.tck, KONZ_005.mammalGrid.mam, KONZ_038.mosquitoPoint.mos, KONZ_039.mosquitoPoint.mos",3/12/15,3/12/15,N,actual,,KONZ.20150312.fire,NEON.DOC.003282vA,fire,fire-controlledBurn,,,,low,,,,,secondary,Watershed containing plot 39Q had a prescribed burn that was not planned.,eminnick@battelleecology.org,,20241118T165724Z,RELEASE-2025
1631,1631,7b6e23cc-72a7-43d6-9552-8e37616f86a0,D06,KONZ,KONZ,"KONZ_013.basePlot.all, KONZ_020.basePlot.all",3/20/15,3/20/15,N,actual,,KONZ.20150320.fire,NEON.DOC.003282vA,fire,fire-controlledBurn,,,,low,,,,,secondary,,eminnick@battelleecology.org,,20241118T165724Z,RELEASE-2025
1632,1632,eee3b8f6-8909-44a7-b811-21f6b3921475,D06,KONZ,KONZ,"KONZ_005.basePlot.all, KONZ_005.mammalGrid.mam, KONZ_038.mosquitoPoint.mos",3/26/15,3/26/15,N,actual,,KONZ.20150326.fire,NEON.DOC.003282vA,fire,fire-controlledBurn,,,,low,,,,,secondary,,eminnick@battelleecology.org,,20241118T165724Z,RELEASE-2025
1633,1633,2b99fe9d-2bb0-4b0d-83bb-69073d58bd36,D06,KONZ,KONZ,KONZ_016.basePlot.all,3/31/15,3/31/15,N,actual,,KONZ.20150331.fire,NEON.DOC.003282vA,fire,fire-controlledBurn,,,,low,,,,,secondary,,eminnick@battelleecology.org,,20241118T165724Z,RELEASE-2025
1635,1635,c6f606f7-d1d6-48c4-af6e-92c33406dfb5,D06,KONZ,KONZ,"KONZ_001.basePlot.all, KONZ_006.basePlot.all, KONZ_010.basePlot.all, KONZ_018.basePlot.all, KONZ_001.tickPlot.tck, KONZ_001.mammalGrid.mam, KONZ_006.mammalGrid.mam",4/14/15,4/14/15,N,actual,,KONZ.20150414.fire,NEON.DOC.003282vA,fire,fire-controlledBurn,,,,low,,,,,secondary,,eminnick@battelleecology.org,,20241118T081802Z,RELEASE-2025
1672,1672,7a96a79c-a78e-49ae-86df-28b7f06bd900,D06,KONZ,KONZ,"KONZ_022.basePlot.all, KONZ_023.basePlot.all, KONZ_024.basePlot.all, KONZ_004.tickPlot.tck",3/11/16,3/11/16,N,actual,,KONZ.20160311.fire,NEON.DOC.003282vA,fire,fire-controlledBurn,,,,low,,,,,secondary,,eminnick@battelleecology.org,,20241118T203245Z,RELEASE-2025
1674,1674,196dd86e-2170-4f1a-9d27-c985cd8e7039,D06,KONZ,KONZ,"KONZ_017.basePlot.all, KONZ_019.basePlot.all, KONZ_009.tickPlot.tck, KONZ_039.mosquitoPoint.mos",4/4/16,4/4/16,N,actual,,KONZ.20160404.fire,NEON.DOC.003282vA,fire,fire-controlledBurn,,,,low,,,,,secondary,,eminnick@battelleecology.org,,20241118T192813Z,RELEASE-2025
1675,1675,4da31c4f-ff0e-44a4-b7e3-ba1eb620aa2b,D06,KONZ,KONZ,KONZ_011.basePlot.all,4/11/16,4/11/16,N,actual,,KONZ.20160411.fire,NEON.DOC.003282vA,fire,fire-controlledBurn,,,,low,,,,,secondary,,eminnick@battelleecology.org,,20241118T192813Z,RELEASE-2025
1676,1676,29138d97-7628-457d-bbab-c64e1aa94a8f,D06,KONZ,KONZ,"KONZ_028.basePlot.all, KONZ_030.basePlot.all, KONZ_046.basePlot.all, KONZ_049.basePlot.all, KONZ_059.basePlot.all, KONZ_063.basePlot.all, KONZ_067.basePlot.all, KONZ_038.mosquitoPoint.mos",4/12/16,4/12/16,N,actual,,KONZ.20160412.fire,NEON.DOC.003282vA,fire,fire-controlledBurn,,,,low,,,,,secondary,,eminnick@battelleecology.org,,20241118T192813Z,RELEASE-2025
1677,1677,34c6b3be-5e67-410d-b544-44da5af6fe0d,D06,KONZ,KONZ,"KONZ_003.basePlot.all, KONZ_005.basePlot.all, KONZ_013.basePlot.all, KONZ_020.basePlot.all, KONZ_026.basePlot.all, KONZ_042.basePlot.all, KONZ_044.basePlot.all, KONZ_050.basePlot.all, KONZ_051.basePlot.all, KONZ_053.basePlot.all, KONZ_054.basePlot.all, KONZ_055.basePlot.all, KONZ_056.basePlot.all, KONZ_064.basePlot.all, KONZ_065.basePlot.all, KONZ_068.basePlot.all, KONZ_070.basePlot.all, KONZ_072.phenology.phe",4/13/16,4/13/16,N,actual,,KONZ.20160413.fire,NEON.DOC.003282vA,fire,fire-controlledBurn,,,,low,,,,,secondary,,eminnick@battelleecology.org,,20241118T192813Z,RELEASE-2025
1679,1679,66d12757-d5d2-4af5-8e10-afd7fad78ce9,D06,KONZ,KONZ,"KONZ_001.basePlot.all, KONZ_006.basePlot.all, KONZ_001.tickPlot.tck, KONZ_001.mammalGrid.mam, KONZ_006.mammalGrid.mam",5/3/16,5/3/16,N,actual,,KONZ.20160503.fire,NEON.DOC.003282vA,fire,fire-controlledBurn,,,,low,,,,,secondary,,eminnick@battelleecology.org,,20241118T063656Z,RELEASE-2025
1690,1690,ab45c114-6b29-4af5-ba6f-0a6a0c0a1668,D06,KONZ,KONZ,KONZ_041.mosquitoPoint.mos,7/26/16,7/26/16,N,actual,,KONZ.20160726.fire,NEON.DOC.003282vA,fire,fire-controlledBurn,,,,low,,,,,secondary,,eminnick@battelleecology.org,,20241118T080341Z,RELEASE-2025
1716,1716,6aac8716-ba63-42c5-a25f-5f7ee4785a45,D06,KONZ,KONZ,"KONZ_017.basePlot.all, KONZ_019.basePlot.all, KONZ_009.tickPlot.tck, KONZ_039.mosquitoPoint.mos",3/9/17,3/9/17,N,actual,,KONZ.20170309.fire,NEON.DOC.003282vA,fire,fire-controlledBurn,,,,low,,,,,secondary,,eminnick@battelleecology.org,,20241118T034620Z,RELEASE-2025
1717,1717,2988e371-6d24-40cd-9b8f-bd65d7112695,D06,KONZ,KONZ,"KONZ_014.basePlot.all, KONZ_019.basePlot.all, KONZ_023.basePlot.all, KONZ_043.basePlot.all, KONZ_045.basePlot.all, KONZ_047.basePlot.all, KONZ_048.basePlot.all, KONZ_052.basePlot.all, KONZ_057.basePlot.all, KONZ_058.basePlot.all, KONZ_060.basePlot.all, KONZ_061.basePlot.all, KONZ_062.basePlot.all, KONZ_066.basePlot.all, KONZ_069.basePlot.all, KONZ_071.basePlot.all",3/10/17,3/10/17,N,actual,,KONZ.20170310.fire,NEON.DOC.003282vA,fire,fire-controlledBurn,,,,low,,,,,secondary,,eminnick@battelleecology.org,,20241118T034620Z,RELEASE-2025
1718,1718,16639562-895d-409f-b737-81804003add8,D06,KONZ,KONZ,"KONZ_028.basePlot.all, KONZ_030.basePlot.all, KONZ_046.basePlot.all, KONZ_049.basePlot.all, KONZ_059.basePlot.all, KONZ_063.basePlot.all, KONZ_067.basePlot.all",3/16/17,3/16/17,N,actual,,KONZ.20170316.fire,NEON.DOC.003282vA,fire,fire-controlledBurn,,,,low,,,,,secondary,,eminnick@battelleecology.org,,20241118T034620Z,RELEASE-2025
1719,1719,00edb99f-10fe-4e98-80f0-cc1d501f66b1,D06,KONZ,KONZ,"KONZ_015.basePlot.all, KONZ_036.mosquitoPoint.mos",3/17/17,3/17/17,N,actual,,KONZ.20170317.fire,NEON.DOC.003282vA,fire,fire-controlledBurn,,,,low,,,,,secondary,,eminnick@battelleecology.org,,20241118T034620Z,RELEASE-2025
1720,1720,2c19fef1-0d96-4c54-80d2-6907a48f1951,D06,KONZ,KONZ,"KONZ_005.basePlot.all, KONZ_012.basePlot.all, KONZ_005.mammalGrid.mam, KONZ_033.mosquitoPoint.mos, KONZ_038.mosquitoPoint.mos",3/20/17,3/20/17,N,actual,,KONZ.20170320.fire,NEON.DOC.003282vA,fire,fire-controlledBurn,,,,low,,,,,secondary,,eminnick@battelleecology.org,,20241118T034620Z,RELEASE-2025
1722,1722,fbe6c073-8e62-4f74-8435-9fe255567e28,D06,KONZ,KONZ,"KONZ_013.basePlot.all, KONZ_020.basePlot.all",4/11/17,4/11/17,N,actual,,KONZ.20170411.fire,NEON.DOC.003282vA,fire,fire-controlledBurn,,,,low,,,,,secondary,,eminnick@battelleecology.org,,20241118T141117Z,RELEASE-2025
1723,1723,c4c8d1fe-1d6c-4adf-9c07-db9f8eee91d3,D06,KONZ,KONZ,"KONZ_001.basePlot.all, KONZ_006.basePlot.all, KONZ_018.basePlot.all, KONZ_001.tickPlot.tck, KONZ_001.mammalGrid.mam, KONZ_006.mammalGrid.mam, KONZ_040.mosquitoPoint.mos",4/13/17,4/13/17,N,actual,,KONZ.20170413.fire,NEON.DOC.003282vA,fire,fire-controlledBurn,,,,low,,,,,secondary,,eminnick@battelleecology.org,,20241118T141117Z,RELEASE-2025
1759,1759,d55f882f-6f4d-4d39-a170-b204cd8ca478,D06,KONZ,KONZ,KONZ_011.basePlot.all,3/1/18,3/1/18,N,actual,,KONZ.20180301.fire,NEON.DOC.003282vA,fire,fire-controlledBurn,,,,low,,,,,secondary,,eminnick@battelleecology.org,,20241118T111334Z,RELEASE-2025
1761,1761,3484b421-1ed4-4382-9bcd-7d3867e51d85,D06,KONZ,KONZ,"KONZ_005.basePlot.all, KONZ_005.mammalGrid.mam",3/9/18,3/9/18,N,actual,,KONZ.20180309.fire,NEON.DOC.003282vA,fire,fire-controlledBurn,,,,low,,,,,secondary,,eminnick@battelleecology.org,,20241118T111334Z,RELEASE-2025
1762,1762,791005b4-6028-4701-9145-75b5c401b9e2,D06,KONZ,KONZ,"KONZ_017.basePlot.all, KONZ_019.basePlot.all, KONZ_009.tickPlot.tck, KONZ_038.mosquitoPoint.mos",3/12/18,3/12/18,N,actual,,KONZ.20180312.fire,NEON.DOC.003282vA,fire,fire-controlledBurn,,,,low,,,,,secondary,,eminnick@battelleecology.org,,20241118T111334Z,RELEASE-2025
1763,1763,59911ea6-1653-4199-b1d9-da8458e586d3,D06,KONZ,KONZ,"KONZ_015.basePlot.all, KONZ_034.mosquitoPoint.mos, KONZ_036.mosquitoPoint.mos, KONZ_037.mosquitoPoint.mos",3/13/18,3/13/18,N,actual,,KONZ.20180313.fire,NEON.DOC.003282vA,fire,fire-controlledBurn,,,,low,,,,,secondary,,eminnick@battelleecology.org,,20241118T111334Z,RELEASE-2025
1764,1764,e4712ecb-8ad0-4e09-a253-502969481f05,D06,KONZ,KONZ,"KONZ_006.basePlot.all, KONZ_006.mammalGrid.mam",3/14/18,3/14/18,N,actual,,KONZ.20180314.fire,NEON.DOC.003282vA,fire,fire-wildfire,,,,low,,,,,secondary,Wildfire on a watershed planned to be burned that year.,eminnick@battelleecology.org,,20241118T111334Z,RELEASE-2025
1765,1765,9d34c03d-b44b-4349-a328-e13d6bde9947,D06,KONZ,KONZ,"SOILPL101152, SOILPL101154, SOILPL101159, SOILPL109679, SOILPL109733, TOWER101161, HUT109578, CFGLOC109787, AIRSHED",3/21/18,3/21/18,N,actual,,KONZ.20180321.fire,NEON.DOC.003282vA,fire,fire-controlledBurn,,,,unknown,,,,,unknown,Prescribed burning of the Konza Prairie K2A plot on which the NEON tower and soil plots are located was conducted on 21 March 2018.,jflavin@battelleecology.org,,20241118T111334Z,RELEASE-2025
1766,1766,cea1385b-0836-47be-8db6-90d28c82828e,D06,KONZ,KONZ,"KONZ_013.basePlot.all, KONZ_020.basePlot.all",3/21/18,3/21/18,N,actual,,KONZ.20180321.fire,NEON.DOC.003282vA,fire,fire-controlledBurn,,,,low,,,,,secondary,,eminnick@battelleecology.org,,20241118T111334Z,RELEASE-2025
1767,1767,c498b598-f6d5-4f65-a7ce-4abaa0952374,D06,KONZ,KONZ,"KONZ_001.basePlot.all, KONZ_001.tickPlot.tck, KONZ_001.mammalGrid.mam",3/30/18,3/30/18,N,actual,,KONZ.20180330.fire,NEON.DOC.003282vA,fire,fire-controlledBurn,,,,low,,,,,secondary,,eminnick@battelleecology.org,,20241118T111334Z,RELEASE-2025
1769,1769,cbb972c3-e63f-48a2-9a52-60a66ab6cd2b,D06,KONZ,KONZ,"KONZ_004.basePlot.all, KONZ_007.basePlot.all, KONZ_008.basePlot.all, KONZ_023.basePlot.all, KONZ_007.tickPlot.tck",4/17/18,4/17/18,N,actual,,KONZ.20180417.fire,NEON.DOC.003282vA,fire,fire-controlledBurn,,,,low,,,,,secondary,,eminnick@battelleecology.org,,20241118T101704Z,RELEASE-2025
1770,1770,0b743ad4-6e98-4e1c-a7ce-97f5f075f5c8,D06,KONZ,KONZ,"KONZ_002.basePlot.all, KONZ_002.tickPlot.tck, KONZ_002.mammalGrid.mam",4/19/18,4/19/18,N,actual,,KONZ.20180419.fire,NEON.DOC.003282vA,fire,fire-controlledBurn,,,,low,,,,,secondary,,eminnick@battelleecology.org,,20241118T101704Z,RELEASE-2025
1787,1787,472a27ed-c762-4a78-b263-8e94b5dcd3f2,D06,KONZ,KONZ,"KONZ_028.basePlot.all, KONZ_030.basePlot.all, KONZ_046.basePlot.all, KONZ_049.basePlot.all, KONZ_059.basePlot.all, KONZ_063.basePlot.all, KONZ_067.basePlot.all",8/1/18,8/1/18,N,actual,,KONZ.20180801.fire,NEON.DOC.003282vA,fire,fire-controlledBurn,,,,low,,,,,secondary,,eminnick@battelleecology.org,,20241118T023254Z,RELEASE-2025
1806,1806,0e80ec60-4f62-4a0c-8bf5-8109ef9ac024,D06,KONZ,KONZ,"KONZ_001.basePlot.all,KONZ_002.basePlot.all,KONZ_003.basePlot.all,KONZ_004.basePlot.all,KONZ_005.basePlot.all,KONZ_006.basePlot.all,KONZ_007.basePlot.all,KONZ_008.basePlot.all,KONZ_009.basePlot.all,KONZ_010.basePlot.all,KONZ_011.basePlot.all,KONZ_012.basePlot.all,KONZ_013.basePlot.all,KONZ_014.basePlot.all,KONZ_015.basePlot.all,KONZ_016.basePlot.all,KONZ_017.basePlot.all,KONZ_018.basePlot.all,KONZ_019.basePlot.all,KONZ_020.basePlot.all,KONZ_021.basePlot.all,KONZ_022.basePlot.all,KONZ_023.basePlot.all,KONZ_024.basePlot.all,KONZ_025.basePlot.all,KONZ_026.basePlot.all,KONZ_027.basePlot.all,KONZ_028.basePlot.all,KONZ_029.basePlot.all,KONZ_030.basePlot.all,KONZ_042.basePlot.all,KONZ_043.basePlot.all,KONZ_044.basePlot.all,KONZ_045.basePlot.all,KONZ_046.basePlot.all,KONZ_047.basePlot.all,KONZ_048.basePlot.all,KONZ_049.basePlot.all,KONZ_050.basePlot.all,KONZ_051.basePlot.all,KONZ_052.basePlot.all,KONZ_053.basePlot.all,KONZ_054.basePlot.all,KONZ_055.basePlot.all,KONZ_056.basePlot.all,KONZ_057.basePlot.all,KONZ_058.basePlot.all,KONZ_059.basePlot.all,KONZ_060.basePlot.all,KONZ_061.basePlot.all,KONZ_062.basePlot.all,KONZ_063.basePlot.all,KONZ_064.basePlot.all,KONZ_065.basePlot.all,KONZ_066.basePlot.all,KONZ_067.basePlot.all,KONZ_068.basePlot.all,KONZ_069.basePlot.all,KONZ_070.basePlot.all,KONZ_071.basePlot.all,KONZ_001.tickPlot.tck,KONZ_002.tickPlot.tck,KONZ_004.tickPlot.tck,KONZ_007.tickPlot.tck,KONZ_009.tickPlot.tck,KONZ_025.tickPlot.tck,KONZ_001.mammalGrid.mam,KONZ_002.mammalGrid.mam,KONZ_003.mammalGrid.mam,KONZ_005.mammalGrid.mam,KONZ_006.mammalGrid.mam,KONZ_008.mammalGrid.mam,KONZ_027.mammalGrid.mam,KONZ_029.mammalGrid.mam,KONZ_001.birdGrid.brd,KONZ_002.birdGrid.brd,KONZ_003.birdGrid.brd,KONZ_005.birdGrid.brd,KONZ_006.birdGrid.brd,KONZ_007.birdGrid.brd,KONZ_008.birdGrid.brd,KONZ_010.birdGrid.brd,KONZ_013.birdGrid.brd,KONZ_025.birdGrid.brd,KONZ_027.birdGrid.brd,KONZ_031.birdGrid.brd,KONZ_032.mosquitoPoint.mos,KONZ_033.mosquitoPoint.mos,KONZ_034.mosquitoPoint.mos,KONZ_035.mosquitoPoint.mos,KONZ_036.mosquitoPoint.mos,KONZ_037.mosquitoPoint.mos,KONZ_038.mosquitoPoint.mos,KONZ_039.mosquitoPoint.mos,KONZ_040.mosquitoPoint.mos,KONZ_041.mosquitoPoint.mos,KONZ_072.phenology.phe,KONZ_073.phenology.phe,KONZ,SOILPL101152,SOILPL101154,SOILPL101159,SOILPL109679,SOILPL109733,MEGAPT100978,TOWER101161,HUT109578,CFGLOC109787,AIRSHED",3/18/19,3/18/19,N,actual,,KONZ.20190318.fire,NEON.DOC.003282vB,fire,fire-controlledBurn,,,,unknown,,,,,unknown,On 18 Mar Konza Prairie staff conducted a controlled burn of a large tract of prairie adjacent to the KONZ TIS site. Some impact on the airborne TIS data collected that day is likely from the effects of the fire.,jflavin@battelleecology.org,,20241118T144625Z,RELEASE-2025
1807,1807,938e121c-1368-44c7-aec2-a6a0d88b0480,D06,KONZ,KONZ,KONZ_035.mosquitoPoint.mos,4/23/19,4/23/19,N,actual,,KONZ.20190423.fire,NEON.DOC.003282vB,fire,fire-controlledBurn,,,,low,,,,,secondary,,eminnick@battelleecology.org,,20241118T113359Z,RELEASE-2025
1810,1810,d5f59533-02c3-4aa8-8dd3-3d3cbc79832a,D06,KONZ,KONZ,KONZ_039.mosquitoPoint.mos,3/2/20,3/2/20,N,actual,,KONZ.20200302.fire,NEON.DOC.003282vC,fire,fire-controlledBurn,,,,low,,,,,secondary,,0000-0002-3172-0145,,20241118T220358Z,RELEASE-2025
